{"version":"canon_geo_run.v0","run_id":"canon_geo_run.v0:035bd2e181018886674b56ebb315690c1cb4358115e30a5846aacb94031432b4","semantic_hash":"blake3:035bd2e181018886674b56ebb315690c1cb4358115e30a5846aacb94031432b4","status":"COMPLETED","phase":"MATERIALIZED","plan_ref":{"plan_id":"canon_geo_plan.v0:21a49f335421d3cb446faac4893294a305e4607c4496f6215905b81cdaf15c6c","semantic_hash":"blake3:21a49f335421d3cb446faac4893294a305e4607c4496f6215905b81cdaf15c6c","project_id":"geo.retry_recovery.home_cells.e2736a66ad582c1c33b37d3934818cff8470ace8526c5578cfc439a8f7dbdc35","project_graph_hash":"blake3:d3a66ededb78a6c75a58c6fdf4406703830ee34de043681ea1ea2e61de7557ff","question_hash":"blake3:c0640f1c8bd207622c9c3324de5c85c4826c41a8d2f785438e104fbc56e18613","capabilities_hash":"blake3:84b206a969cf1336d8287008acde16a74e0c5db4c8100206f6106774d2813c25","inventory_planning_hash":"blake3:8a5010603252738813d9b948471cf4d8ca08bd33e900acd0ddb3845e2ef0de7b","profile_hash":"blake3:af95d4f49d90e83312411cd57f81e908a27914994cbe2decf864e87adf8a52b7","budget_planning_hash":"blake3:04f0f8e819c18a2203e11cb00e52761e1006513334ff9ed5c45fdb848f4307fb"},"artifact_inputs":[{"node_id":"geo.retry_recovery.home_cells","binding_id":"rows","artifact_id":"geo.retry_recovery.home_cells/input/rows","content_digest":"blake3:f4260418d4b6a97849622e77ce865dfe4f16712d1268573d8a4ab58f1a7d2e27","media_type":"application/json","contract_version":"canon_geo_home_cell_rows.v1","byte_count":1156}],"output_refs":[{"artifact_id":"geo.retry_recovery.home_cells/home_cells","project_node_id":"geo.retry_recovery.home_cells","output_id":"home_cells","content_digest":"blake3:7bb47dda963e6fec917cf1e674e071d018063cbc1426dfa062dc7e29b26a31b4","byte_count":2198,"media_type":"application/json","contract_version":"canon_geo_home_cell_assignment.v1","home_cell_r9":"892a100dca7ffff"}],"grain_states":[{"entity_level":"address","status":"planned_relative_to_declared_universe","project_node_ids":["geo.retry_recovery.home_cells"],"claim_limitation":"retry recovery home-cell materialization is reach-only; precision remains unclaimed","next_action":"record this run into the retry loop, then measure recovered/abstained/blocked"}],"deterministic_usage":{"boundary_sensitive_features":0,"dependency_output_count":0,"executor_supported_command_count":18,"home_cell_features":1,"home_cell_rows":1,"input_binding_count":1},"project_run_report":{"schema_version":"canon.project.run.v2","project_id":"geo.retry_recovery.home_cells.e2736a66ad582c1c33b37d3934818cff8470ace8526c5578cfc439a8f7dbdc35","plan_graph_hash":"blake3:d3a66ededb78a6c75a58c6fdf4406703830ee34de043681ea1ea2e61de7557ff","run_receipt_hash":"blake3:a3cf006819e01fbaa46d859aba0871da6e969624e0498c7f302a976a8a6a81d9","max_parallelism":1,"max_ready_width":1,"executed_nodes":["geo.retry_recovery.home_cells"],"resumed_nodes":[],"failed_nodes":[],"cancelled_nodes":[],"invalidated_nodes":[],"blocked_nodes":[],"next_actions":{},"receipt":{"schema_version":"canon.project.run.v2","project_id":"geo.retry_recovery.home_cells.e2736a66ad582c1c33b37d3934818cff8470ace8526c5578cfc439a8f7dbdc35","plan_graph_hash":"blake3:d3a66ededb78a6c75a58c6fdf4406703830ee34de043681ea1ea2e61de7557ff","receipt_hash":"blake3:a3cf006819e01fbaa46d859aba0871da6e969624e0498c7f302a976a8a6a81d9","completed_nodes":["geo.retry_recovery.home_cells"],"failed_nodes":[],"cancelled_nodes":[],"invalidated_nodes":[],"blocked_nodes":[],"node_receipts":[{"schema_version":"canon.project.run.v2","project_id":"geo.retry_recovery.home_cells.e2736a66ad582c1c33b37d3934818cff8470ace8526c5578cfc439a8f7dbdc35","plan_graph_hash":"blake3:d3a66ededb78a6c75a58c6fdf4406703830ee34de043681ea1ea2e61de7557ff","node_id":"geo.retry_recovery.home_cells","node_cache_key":"blake3:06cf0813b3296cc3e385ddae9b6fa9cf688c52a771c909b8a103cbf5436de2d3","content_hash_inputs":[{"ref_id":"geo.run.input.geo.retry_recovery.home_cells.rows","content_hash":"blake3:f4260418d4b6a97849622e77ce865dfe4f16712d1268573d8a4ab58f1a7d2e27"}],"outputs":[{"output_id":"home_cells","path":"geo/retry_recovery/e2736a66ad582c1c33b37d3934818cff8470ace8526c5578cfc439a8f7dbdc35/home_cells.json","content_digest":"blake3:7bb47dda963e6fec917cf1e674e071d018063cbc1426dfa062dc7e29b26a31b4","byte_count":2198}],"outcome":"completed","deterministic_usage":{"boundary_sensitive_features":0,"dependency_output_count":0,"executor_supported_command_count":18,"home_cell_features":1,"home_cell_rows":1,"input_binding_count":1},"duration_millis":0,"next_action":"execute_dependents","semantic_hash":"blake3:2378ac3e0e57973b49498c6779564efd430bd8ebc34a76ab97eac3b68c38d357","telemetry_hash":"blake3:381eb23bb5bac53f925c04b954d08c9096a55c9908e8981dee53f301e8ba939b","receipt_hash":"blake3:a131fddf225222716dd5d0f02af959fccfeb8fd3206263d113b155b36b222221"}]},"node_reports":[{"node_id":"geo.retry_recovery.home_cells","outcome":"completed","receipt_hash":"blake3:a131fddf225222716dd5d0f02af959fccfeb8fd3206263d113b155b36b222221"}]},"observation":{}}