{"version":"canon_geo_run.v0","run_id":"canon_geo_run.v0:2c137aeb06f776afa8de3599e0f9194bf61cd4902e1871dc7a1843e7940f27fe","semantic_hash":"blake3:2c137aeb06f776afa8de3599e0f9194bf61cd4902e1871dc7a1843e7940f27fe","status":"COMPLETED","phase":"MATERIALIZED","plan_ref":{"plan_id":"canon_geo_plan.v0:0dce3badfdbff7c6f2774f4b8d76e4a64b0a183c51ecbb73beb0c68b1718585c","semantic_hash":"blake3:0dce3badfdbff7c6f2774f4b8d76e4a64b0a183c51ecbb73beb0c68b1718585c","project_id":"geo.retry_recovery.record.b74dd34b0ce87b01b15041baaa659ad5db60ce03247b29c141ff87bda99bfe23","project_graph_hash":"blake3:114df88b175a1e030f40bd4ba3167b69bf3a544dd48912aab2162920c66a3a90","question_hash":"blake3:86bb701c59188b1d25ea17bb2c7ec91c0b0d1e594a43b3c78e9c0a89ee3e096d","capabilities_hash":"blake3:85fab25cf573e6375a697172abb049cf6ac982b754af43ea535c9516de94e42d","inventory_planning_hash":"blake3:10cf93487beb56905fb9e0b4b44d9de76fd0f6859a075636538f3d635cf165e8","profile_hash":"blake3:c8b4d6e3cb6ee11d1534b55fee75d6825db0dcdf0530628796a4738d16a3981f","budget_planning_hash":"blake3:4f0e6914492c8265bb98f6b82d6bd75b243088036e285958866eb747db8cc329"},"artifact_inputs":[{"node_id":"geo.retry_recovery.retry_pass","binding_id":"latest_run","artifact_id":"geo.retry_recovery.retry_pass/input/latest_run","content_digest":"blake3:50a0af9e5b9085a9592ec502be1b9e10ecf60985d0ff9157ba4abd80a29ba7e4","media_type":"application/json","contract_version":"canon_geo_run.v0","byte_count":4967},{"node_id":"geo.retry_recovery.retry_pass","binding_id":"receipt","artifact_id":"geo.retry_recovery.retry_pass/input/receipt","content_digest":"blake3:4d177d6195eb388eeb97057b057727ebc6f2765173f6c1356fb530b91758546d","media_type":"application/json","contract_version":"canon_geo_acquisition_receipt.v0","byte_count":5156},{"node_id":"geo.retry_recovery.retry_pass","binding_id":"retry_loop","artifact_id":"geo.retry_recovery.retry_pass/input/retry_loop","content_digest":"blake3:9778e21c39e6332f0ddcb218c0209940ec92684c0d853eb967c8625c8ce4d857","media_type":"application/json","contract_version":"canon_geo_retry_loop.v0","byte_count":2000}],"output_refs":[{"artifact_id":"geo.retry_recovery.retry_pass/retry_loop","project_node_id":"geo.retry_recovery.retry_pass","output_id":"retry_loop","content_digest":"blake3:2ec7e9185091b644a44cb738b806803826e1b6f6fd238514231ccb8aa67d5c41","byte_count":4201,"media_type":"application/json","contract_version":"canon_geo_retry_loop.v0"}],"grain_states":[{"entity_level":"building","status":"planned_relative_to_declared_universe","project_node_ids":["geo.retry_recovery.retry_pass"],"claim_limitation":"retry-pass recording binds fresh acquisition receipts for reach only; precision remains unclaimed","next_action":"after all frozen 40 loops are terminal, run measure-retry-recovery"}],"deterministic_usage":{"dependency_output_count":0,"executor_supported_command_count":18,"input_binding_count":3,"retry_loop_next_request_emitted":0,"retry_loop_passes":1,"retry_loop_previous_passes":0,"retry_loop_receipt_bound":1,"retry_loop_recorded_passes":1,"retry_loop_terminal":1},"project_run_report":{"schema_version":"canon.project.run.v2","project_id":"geo.retry_recovery.record.b74dd34b0ce87b01b15041baaa659ad5db60ce03247b29c141ff87bda99bfe23","plan_graph_hash":"blake3:114df88b175a1e030f40bd4ba3167b69bf3a544dd48912aab2162920c66a3a90","run_receipt_hash":"blake3:ecbcc85491685615c1bc05162edc1cbfe9096316ceed267e41c17aa1834c299a","max_parallelism":1,"max_ready_width":1,"executed_nodes":["geo.retry_recovery.retry_pass"],"resumed_nodes":[],"failed_nodes":[],"cancelled_nodes":[],"invalidated_nodes":[],"blocked_nodes":[],"next_actions":{},"receipt":{"schema_version":"canon.project.run.v2","project_id":"geo.retry_recovery.record.b74dd34b0ce87b01b15041baaa659ad5db60ce03247b29c141ff87bda99bfe23","plan_graph_hash":"blake3:114df88b175a1e030f40bd4ba3167b69bf3a544dd48912aab2162920c66a3a90","receipt_hash":"blake3:ecbcc85491685615c1bc05162edc1cbfe9096316ceed267e41c17aa1834c299a","completed_nodes":["geo.retry_recovery.retry_pass"],"failed_nodes":[],"cancelled_nodes":[],"invalidated_nodes":[],"blocked_nodes":[],"node_receipts":[{"schema_version":"canon.project.run.v2","project_id":"geo.retry_recovery.record.b74dd34b0ce87b01b15041baaa659ad5db60ce03247b29c141ff87bda99bfe23","plan_graph_hash":"blake3:114df88b175a1e030f40bd4ba3167b69bf3a544dd48912aab2162920c66a3a90","node_id":"geo.retry_recovery.retry_pass","node_cache_key":"blake3:7709d0d1e4221e17725e8398534d9535c404b40a9810a1b3c3df4e44cc113fc8","content_hash_inputs":[{"ref_id":"geo.run.input.geo.retry_recovery.retry_pass.latest_run","content_hash":"blake3:50a0af9e5b9085a9592ec502be1b9e10ecf60985d0ff9157ba4abd80a29ba7e4"},{"ref_id":"geo.run.input.geo.retry_recovery.retry_pass.receipt","content_hash":"blake3:4d177d6195eb388eeb97057b057727ebc6f2765173f6c1356fb530b91758546d"},{"ref_id":"geo.run.input.geo.retry_recovery.retry_pass.retry_loop","content_hash":"blake3:9778e21c39e6332f0ddcb218c0209940ec92684c0d853eb967c8625c8ce4d857"}],"outputs":[{"output_id":"retry_loop","path":"geo/retry_recovery/b74dd34b0ce87b01b15041baaa659ad5db60ce03247b29c141ff87bda99bfe23/pass-01/retry_loop.json","content_digest":"blake3:2ec7e9185091b644a44cb738b806803826e1b6f6fd238514231ccb8aa67d5c41","byte_count":4201}],"outcome":"completed","deterministic_usage":{"dependency_output_count":0,"executor_supported_command_count":18,"input_binding_count":3,"retry_loop_next_request_emitted":0,"retry_loop_passes":1,"retry_loop_previous_passes":0,"retry_loop_receipt_bound":1,"retry_loop_recorded_passes":1,"retry_loop_terminal":1},"duration_millis":0,"next_action":"execute_dependents","semantic_hash":"blake3:9d62bc362d431a09579995e6e0c243e51000e2f8e0ba0ce003e872278036d12f","telemetry_hash":"blake3:1ab5bfa674aa5f7f9f75ba47d20ed6c161f453ad58835abe3b27b83e18089353","receipt_hash":"blake3:6ea57155debb5e29b74890a486d2d6599a2d7df62953e39225e7eed6bcf1e60f"}]},"node_reports":[{"node_id":"geo.retry_recovery.retry_pass","outcome":"completed","receipt_hash":"blake3:6ea57155debb5e29b74890a486d2d6599a2d7df62953e39225e7eed6bcf1e60f"}]},"observation":{}}