{"version":"canon_geo_run.v0","run_id":"canon_geo_run.v0:ba49676d43400794f11180ce9fc96c6fe6e1fa2f8272b3955c2626bdd2452c65","semantic_hash":"blake3:ba49676d43400794f11180ce9fc96c6fe6e1fa2f8272b3955c2626bdd2452c65","status":"COMPLETED","phase":"MATERIALIZED","plan_ref":{"plan_id":"canon_geo_plan.v0:7e25e7c100cb494dc99041be10020ee8383df40a6916b7cbfbb181d8d269c094","semantic_hash":"blake3:7e25e7c100cb494dc99041be10020ee8383df40a6916b7cbfbb181d8d269c094","project_id":"geo.retry_recovery.home_cells.ccf578bbc6770756fd6ba9cf568c8a2c822ec8948b2ff2a99b7179304916e156","project_graph_hash":"blake3:92867eb8d26ea200fc340c7a34d472c9c187ce57b3da583a020fc5115eef88fd","question_hash":"blake3:24fa6847cfcf62a9718c8a58b22803ff466ab6b74ebf0757031e2df54186a3ec","capabilities_hash":"blake3:84b206a969cf1336d8287008acde16a74e0c5db4c8100206f6106774d2813c25","inventory_planning_hash":"blake3:b60433e86dc093429a496e54e7f69738d98c23141fdfbfd8640d7c67701a1bcc","profile_hash":"blake3:af95d4f49d90e83312411cd57f81e908a27914994cbe2decf864e87adf8a52b7","budget_planning_hash":"blake3:04f0f8e819c18a2203e11cb00e52761e1006513334ff9ed5c45fdb848f4307fb"},"artifact_inputs":[{"node_id":"geo.retry_recovery.home_cells","binding_id":"rows","artifact_id":"geo.retry_recovery.home_cells/input/rows","content_digest":"blake3:05e42c736c5cb140cb2fbab8efff66bedb6d65dda49c34d0439992997c37861a","media_type":"application/json","contract_version":"canon_geo_home_cell_rows.v1","byte_count":1156}],"output_refs":[{"artifact_id":"geo.retry_recovery.home_cells/home_cells","project_node_id":"geo.retry_recovery.home_cells","output_id":"home_cells","content_digest":"blake3:d61447282a74fcdec5181d5fb4f69ae4eb938bd25164a47c646bde1de4989474","byte_count":2198,"media_type":"application/json","contract_version":"canon_geo_home_cell_assignment.v1","home_cell_r9":"892a1074103ffff"}],"grain_states":[{"entity_level":"address","status":"planned_relative_to_declared_universe","project_node_ids":["geo.retry_recovery.home_cells"],"claim_limitation":"retry recovery home-cell materialization is reach-only; precision remains unclaimed","next_action":"record this run into the retry loop, then measure recovered/abstained/blocked"}],"deterministic_usage":{"boundary_sensitive_features":0,"dependency_output_count":0,"executor_supported_command_count":18,"home_cell_features":1,"home_cell_rows":1,"input_binding_count":1},"project_run_report":{"schema_version":"canon.project.run.v2","project_id":"geo.retry_recovery.home_cells.ccf578bbc6770756fd6ba9cf568c8a2c822ec8948b2ff2a99b7179304916e156","plan_graph_hash":"blake3:92867eb8d26ea200fc340c7a34d472c9c187ce57b3da583a020fc5115eef88fd","run_receipt_hash":"blake3:59d6905f20f1f06222511020ac3c76f9caeb1ae2dab8164cb4e8fe4ef92f73b7","max_parallelism":1,"max_ready_width":1,"executed_nodes":["geo.retry_recovery.home_cells"],"resumed_nodes":[],"failed_nodes":[],"cancelled_nodes":[],"invalidated_nodes":[],"blocked_nodes":[],"next_actions":{},"receipt":{"schema_version":"canon.project.run.v2","project_id":"geo.retry_recovery.home_cells.ccf578bbc6770756fd6ba9cf568c8a2c822ec8948b2ff2a99b7179304916e156","plan_graph_hash":"blake3:92867eb8d26ea200fc340c7a34d472c9c187ce57b3da583a020fc5115eef88fd","receipt_hash":"blake3:59d6905f20f1f06222511020ac3c76f9caeb1ae2dab8164cb4e8fe4ef92f73b7","completed_nodes":["geo.retry_recovery.home_cells"],"failed_nodes":[],"cancelled_nodes":[],"invalidated_nodes":[],"blocked_nodes":[],"node_receipts":[{"schema_version":"canon.project.run.v2","project_id":"geo.retry_recovery.home_cells.ccf578bbc6770756fd6ba9cf568c8a2c822ec8948b2ff2a99b7179304916e156","plan_graph_hash":"blake3:92867eb8d26ea200fc340c7a34d472c9c187ce57b3da583a020fc5115eef88fd","node_id":"geo.retry_recovery.home_cells","node_cache_key":"blake3:44c5bcae3de85e6d93e6c1f3d446f5d30cd6f28afc8e6a9a4dbfbd05f90cee34","content_hash_inputs":[{"ref_id":"geo.run.input.geo.retry_recovery.home_cells.rows","content_hash":"blake3:05e42c736c5cb140cb2fbab8efff66bedb6d65dda49c34d0439992997c37861a"}],"outputs":[{"output_id":"home_cells","path":"geo/retry_recovery/ccf578bbc6770756fd6ba9cf568c8a2c822ec8948b2ff2a99b7179304916e156/home_cells.json","content_digest":"blake3:d61447282a74fcdec5181d5fb4f69ae4eb938bd25164a47c646bde1de4989474","byte_count":2198}],"outcome":"completed","deterministic_usage":{"boundary_sensitive_features":0,"dependency_output_count":0,"executor_supported_command_count":18,"home_cell_features":1,"home_cell_rows":1,"input_binding_count":1},"duration_millis":0,"next_action":"execute_dependents","semantic_hash":"blake3:39bd11a59fe8165498d8ebab885bd284b004587a97496faee065420eeea8053e","telemetry_hash":"blake3:60aef2ff14c6461a501353200e9da935d372794f7de66a63e5ffcdc9957a5732","receipt_hash":"blake3:543a6934d02feb5cc95d258fa59ce8dc56a690146717250ca7ecc828de601300"}]},"node_reports":[{"node_id":"geo.retry_recovery.home_cells","outcome":"completed","receipt_hash":"blake3:543a6934d02feb5cc95d258fa59ce8dc56a690146717250ca7ecc828de601300"}]},"observation":{}}