{"version":"canon_geo_run.v0","run_id":"canon_geo_run.v0:87a1beb787324784de28d4600c8b0f10052c2b55ffc7838152d6492ee71db5fe","semantic_hash":"blake3:87a1beb787324784de28d4600c8b0f10052c2b55ffc7838152d6492ee71db5fe","status":"COMPLETED","phase":"MATERIALIZED","plan_ref":{"plan_id":"canon_geo_plan.v0:2d8af78426385fc83c28da5a4c2d5f72ea516b3b323dca52f9a62240905b7f8f","semantic_hash":"blake3:2d8af78426385fc83c28da5a4c2d5f72ea516b3b323dca52f9a62240905b7f8f","project_id":"geo.retry_recovery.home_cells.c2e0e8fb2acafd43e5f64ef5cda1e262412459aa9236b12ff568481981ae3c34","project_graph_hash":"blake3:4fdf848d07c6f5b4fd9be61878d44c41bb00b790fdb121246cb7d0b523261a2d","question_hash":"blake3:a0fb1afa0d081e0ab9676b4962fe9b4299707816758f06e8a8931afb6f5001f6","capabilities_hash":"blake3:84b206a969cf1336d8287008acde16a74e0c5db4c8100206f6106774d2813c25","inventory_planning_hash":"blake3:04169b4469e54744e3361c81f7c7ebfb810c639158b62d21c3735fb3cc19f7b5","profile_hash":"blake3:af95d4f49d90e83312411cd57f81e908a27914994cbe2decf864e87adf8a52b7","budget_planning_hash":"blake3:04f0f8e819c18a2203e11cb00e52761e1006513334ff9ed5c45fdb848f4307fb"},"artifact_inputs":[{"node_id":"geo.retry_recovery.home_cells","binding_id":"rows","artifact_id":"geo.retry_recovery.home_cells/input/rows","content_digest":"blake3:88687f208fea6beccf7384e29435da015cd9b74380f6bdecdb2ddbf05790fbf2","media_type":"application/json","contract_version":"canon_geo_home_cell_rows.v1","byte_count":1156}],"output_refs":[{"artifact_id":"geo.retry_recovery.home_cells/home_cells","project_node_id":"geo.retry_recovery.home_cells","output_id":"home_cells","content_digest":"blake3:2f801bb10bc80421998988e0c8db30a0b23536e7815d222665200a59a9987743","byte_count":2198,"media_type":"application/json","contract_version":"canon_geo_home_cell_assignment.v1","home_cell_r9":"892a100f12fffff"}],"grain_states":[{"entity_level":"address","status":"planned_relative_to_declared_universe","project_node_ids":["geo.retry_recovery.home_cells"],"claim_limitation":"retry recovery home-cell materialization is reach-only; precision remains unclaimed","next_action":"record this run into the retry loop, then measure recovered/abstained/blocked"}],"deterministic_usage":{"boundary_sensitive_features":0,"dependency_output_count":0,"executor_supported_command_count":18,"home_cell_features":1,"home_cell_rows":1,"input_binding_count":1},"project_run_report":{"schema_version":"canon.project.run.v2","project_id":"geo.retry_recovery.home_cells.c2e0e8fb2acafd43e5f64ef5cda1e262412459aa9236b12ff568481981ae3c34","plan_graph_hash":"blake3:4fdf848d07c6f5b4fd9be61878d44c41bb00b790fdb121246cb7d0b523261a2d","run_receipt_hash":"blake3:1ed4ae8cdeacb5d15c56c6ddbc016e68fbdae61d5a5c296ebf87fcbc2b34609b","max_parallelism":1,"max_ready_width":1,"executed_nodes":["geo.retry_recovery.home_cells"],"resumed_nodes":[],"failed_nodes":[],"cancelled_nodes":[],"invalidated_nodes":[],"blocked_nodes":[],"next_actions":{},"receipt":{"schema_version":"canon.project.run.v2","project_id":"geo.retry_recovery.home_cells.c2e0e8fb2acafd43e5f64ef5cda1e262412459aa9236b12ff568481981ae3c34","plan_graph_hash":"blake3:4fdf848d07c6f5b4fd9be61878d44c41bb00b790fdb121246cb7d0b523261a2d","receipt_hash":"blake3:1ed4ae8cdeacb5d15c56c6ddbc016e68fbdae61d5a5c296ebf87fcbc2b34609b","completed_nodes":["geo.retry_recovery.home_cells"],"failed_nodes":[],"cancelled_nodes":[],"invalidated_nodes":[],"blocked_nodes":[],"node_receipts":[{"schema_version":"canon.project.run.v2","project_id":"geo.retry_recovery.home_cells.c2e0e8fb2acafd43e5f64ef5cda1e262412459aa9236b12ff568481981ae3c34","plan_graph_hash":"blake3:4fdf848d07c6f5b4fd9be61878d44c41bb00b790fdb121246cb7d0b523261a2d","node_id":"geo.retry_recovery.home_cells","node_cache_key":"blake3:a2ccc9c248cb8440f972b37f5eacb5d1605444b1edd4ac24a6257e739be7292e","content_hash_inputs":[{"ref_id":"geo.run.input.geo.retry_recovery.home_cells.rows","content_hash":"blake3:88687f208fea6beccf7384e29435da015cd9b74380f6bdecdb2ddbf05790fbf2"}],"outputs":[{"output_id":"home_cells","path":"geo/retry_recovery/c2e0e8fb2acafd43e5f64ef5cda1e262412459aa9236b12ff568481981ae3c34/home_cells.json","content_digest":"blake3:2f801bb10bc80421998988e0c8db30a0b23536e7815d222665200a59a9987743","byte_count":2198}],"outcome":"completed","deterministic_usage":{"boundary_sensitive_features":0,"dependency_output_count":0,"executor_supported_command_count":18,"home_cell_features":1,"home_cell_rows":1,"input_binding_count":1},"duration_millis":0,"next_action":"execute_dependents","semantic_hash":"blake3:c366cde363b90a8b2856bd2b30cc089c65ba439b5eeaf3e3449cdfba0835e0bf","telemetry_hash":"blake3:48888212bccfe5c08f7571143d57293c1fb4c93cace4a1d2b3ec7b1f234ed3ab","receipt_hash":"blake3:65f2e005935f061f7548cd816d4c6af58b4d3eb7bbd94b5ec159ffcbf735f7c1"}]},"node_reports":[{"node_id":"geo.retry_recovery.home_cells","outcome":"completed","receipt_hash":"blake3:65f2e005935f061f7548cd816d4c6af58b4d3eb7bbd94b5ec159ffcbf735f7c1"}]},"observation":{}}